{"$schema":"https://json-schema.org/draft/2020-12/schema","$id":"https://github.com/smallwei0301/vibeaico-admin-rebuild/.agents/schemas/agent-run-v2.schema.json","title":"VibeAI B+ Agent Run Ledger v2","type":"object","additionalProperties":false,"required":["schemaVersion","runId","status","startedAt","endedAt","sources","main","inventory","modelUsage","delivery","ci","quality","flow","auditability","completionTruth","notes"],"properties":{"schemaVersion":{"const":2},"runId":{"type":"string","pattern":"^[0-9]{4}-[0-9]{2}-[0-9]{2}-[a-zA-Z0-9._-]+$"},"status":{"enum":["BASELINE","IN_PROGRESS","COMPLETE","OWNER_BLOCKED","CLOSURE_RECOVERY"]},"startedAt":{"type":"string"},"endedAt":{"type":["string","null"]},"sources":{"type":"array"},"main":{"$ref":"#/$defs/main"},"inventory":{"$ref":"#/$defs/inventory"},"modelUsage":{"$ref":"#/$defs/modelUsage"},"delivery":{"$ref":"#/$defs/delivery"},"ci":{"$ref":"#/$defs/ci"},"quality":{"$ref":"#/$defs/quality"},"flow":{"$ref":"#/$defs/flow"},"auditability":{"$ref":"#/$defs/auditability"},"completionTruth":{"$ref":"#/$defs/completionTruth"},"notes":{"type":"array","items":{"type":"string"}}},"$defs":{"numberOrNull":{"type":["number","null"],"minimum":0},"percentOrNull":{"type":["number","null"],"minimum":0,"maximum":100},"main":{"type":"object","additionalProperties":false,"required":["startSha","endSha"],"properties":{"startSha":{"type":["string","null"]},"endSha":{"type":["string","null"]}}},"inventory":{"type":"object","additionalProperties":false,"required":["openIssuesStart","openIssuesEnd","openPrsStart","openPrsEnd","mainTerraPeak","reserveTerraPeak","activeCandidatePeak","sharedTestPeak","closureSweeps","closureAdvancedOrClosed"],"properties":{"openIssuesStart":{"$ref":"#/$defs/numberOrNull"},"openIssuesEnd":{"$ref":"#/$defs/numberOrNull"},"openPrsStart":{"$ref":"#/$defs/numberOrNull"},"openPrsEnd":{"$ref":"#/$defs/numberOrNull"},"mainTerraPeak":{"$ref":"#/$defs/numberOrNull"},"reserveTerraPeak":{"$ref":"#/$defs/numberOrNull"},"activeCandidatePeak":{"$ref":"#/$defs/numberOrNull"},"sharedTestPeak":{"$ref":"#/$defs/numberOrNull"},"closureSweeps":{"$ref":"#/$defs/numberOrNull"},"closureAdvancedOrClosed":{"$ref":"#/$defs/numberOrNull"}}},"modelUsage":{"type":"object","additionalProperties":false,"required":["actualTokensAvailable","weeklyUsageStartPercent","weeklyUsageEndPercent","weightedUsageImprovementPercent","weights","contextMultipliers","tasks","fullContextReplays","duplicateScans"],"properties":{"actualTokensAvailable":{"type":"boolean"},"weeklyUsageStartPercent":{"$ref":"#/$defs/percentOrNull"},"weeklyUsageEndPercent":{"$ref":"#/$defs/percentOrNull"},"weightedUsageImprovementPercent":{"type":["number","null"]},"weights":{"type":"object"},"contextMultipliers":{"type":"object"},"tasks":{"type":"array"},"fullContextReplays":{"$ref":"#/$defs/numberOrNull"},"duplicateScans":{"$ref":"#/$defs/numberOrNull"}}},"delivery":{"type":"object","additionalProperties":false,"required":["issuesStarted","issuesClosed","auditReady","ownerBlockedComplete","exactHeadCiOnly","commitOnly","unfinishedCarryover","cycleTimeMinutes"],"properties":{"issuesStarted":{"$ref":"#/$defs/numberOrNull"},"issuesClosed":{"$ref":"#/$defs/numberOrNull"},"auditReady":{"$ref":"#/$defs/numberOrNull"},"ownerBlockedComplete":{"$ref":"#/$defs/numberOrNull"},"exactHeadCiOnly":{"$ref":"#/$defs/numberOrNull"},"commitOnly":{"$ref":"#/$defs/numberOrNull"},"unfinishedCarryover":{"$ref":"#/$defs/numberOrNull"},"cycleTimeMinutes":{"$ref":"#/$defs/numberOrNull"}}},"ci":{"type":"object","additionalProperties":false,"required":["fullCiRuns","invalidReruns","firstPassRatePercent","sharedTestCollisions"],"properties":{"fullCiRuns":{"$ref":"#/$defs/numberOrNull"},"invalidReruns":{"$ref":"#/$defs/numberOrNull"},"firstPassRatePercent":{"$ref":"#/$defs/percentOrNull"},"sharedTestCollisions":{"$ref":"#/$defs/numberOrNull"}}},"quality":{"type":"object","additionalProperties":false,"required":["acceptanceEvidenceCoveragePercent","auditFirstPassRatePercent","unresolvedP0","unresolvedP1","reopenedIssues","postMergeRegressions","safetyViolations","hardFailReasons"],"properties":{"acceptanceEvidenceCoveragePercent":{"$ref":"#/$defs/percentOrNull"},"auditFirstPassRatePercent":{"$ref":"#/$defs/percentOrNull"},"unresolvedP0":{"$ref":"#/$defs/numberOrNull"},"unresolvedP1":{"$ref":"#/$defs/numberOrNull"},"reopenedIssues":{"$ref":"#/$defs/numberOrNull"},"postMergeRegressions":{"$ref":"#/$defs/numberOrNull"},"safetyViolations":{"$ref":"#/$defs/numberOrNull"},"hardFailReasons":{"type":"array","items":{"type":"string"}}}},"flow":{"type":"object","additionalProperties":false,"required":["lunaTasks","lunaAccepted","lunaDelegationRatePercent","duplicateAgentTasks","ownershipCollisions","waitTimeConvertedPercent","solTouches","solIssues"],"properties":{"lunaTasks":{"$ref":"#/$defs/numberOrNull"},"lunaAccepted":{"$ref":"#/$defs/numberOrNull"},"lunaDelegationRatePercent":{"$ref":"#/$defs/percentOrNull"},"duplicateAgentTasks":{"$ref":"#/$defs/numberOrNull"},"ownershipCollisions":{"$ref":"#/$defs/numberOrNull"},"waitTimeConvertedPercent":{"$ref":"#/$defs/percentOrNull"},"solTouches":{"$ref":"#/$defs/numberOrNull"},"solIssues":{"$ref":"#/$defs/numberOrNull"}}},"auditability":{"type":"object","additionalProperties":false,"required":["evidenceFieldsCompletePercent","exactHeadTestCoveragePercent","stalePendingDescriptions","preciseBlockersPercent","scoreInputsCompletePercent"],"properties":{"evidenceFieldsCompletePercent":{"$ref":"#/$defs/percentOrNull"},"exactHeadTestCoveragePercent":{"$ref":"#/$defs/percentOrNull"},"stalePendingDescriptions":{"$ref":"#/$defs/numberOrNull"},"preciseBlockersPercent":{"$ref":"#/$defs/percentOrNull"},"scoreInputsCompletePercent":{"$ref":"#/$defs/percentOrNull"}}},"completionTruth":{"type":"object","additionalProperties":false,"required":["status","checkedAt","claims"],"properties":{"status":{"enum":["NOT_CHECKED","VERIFIED","FAILED"]},"checkedAt":{"type":["string","null"]},"claims":{"type":"array","items":{"type":"object","additionalProperties":false,"required":["type","subject","claimedState","observedState","verification","evidenceRef"],"properties":{"type":{"enum":["ISSUE_CLOSED","OWNER_BLOCKED_COMPLETE","PR_MERGED","CI_GREEN","LOCAL_TEST_GREEN","RUN_COMPLETE","OTHER"]},"subject":{"type":"string","minLength":1},"claimedState":{"type":"string","minLength":1},"observedState":{"type":"string","minLength":1},"verification":{"enum":["VERIFIED","UNVERIFIED","CONTRADICTED"]},"evidenceRef":{"type":"string"}}}}}}}}